{
  "id": "S01", "scene": "病房走廊", "title": "林小满穿过夜里的走廊", "dur": 14, "mode": "lock_identity",
  "refs": [
    {"file": "素材库/人物/林小满_特写.png", "role": "identity", "note": "林小满，29 岁夜班护士，右眉一道小疤"},
    {"file": "素材库/场景/病房走廊_夜_空景.png", "role": "location", "note": "病房走廊，夜"}
  ],
  "shots": [
    {"at": 0, "size": "全景", "camera": "固定机位", "text": "夜里的病房走廊，日光灯一盏接一盏，林小满抱着病历夹从尽头走来", "sound": "日光灯的嗡声。", "end_state": "林小满走到走廊中段"},
    {"at": 4, "size": "中景", "camera": "跟拍", "text": "她边走边翻病历夹，脚步放慢", "sound": "日光灯的嗡声", "end_state": "林小满停在护士站旁"},
    {"at": 8, "size": "近景", "text": "她抬头看向七床的门牌，眉头一紧", "sound": "远处监护仪的滴滴声；"},
    {"at": 11, "size": "中景", "camera": "缓慢推近", "text": "她走到七床门口，手搭上门把", "lines": [{"speaker": "林小满", "text": "七床？", "delivery": "压低声音"}], "end_state": "林小满站在七床门口，右手搭在门把上，面朝房门。"}
  ]
}
